{
  "$schema": "./conversation-starters.schema.json",
  "version": 1,
  "updated": "2025-10-16",
  "generalFallback": [
    {
      "id": "themes",
      "label": "Summarize Themes",
      "prompt": "Summarize key themes across the most recent documents.",
      "complexity": "Simple"
    },
    {
      "id": "gaps",
      "label": "Identify Gaps",
      "prompt": "What gaps or missing details should I clarify next?",
      "complexity": "Moderate"
    }
  ],
  "sets": [
    {
      "agentIds": ["financial-knowledge-base"],
      "starters": [
        {
          "id": "vanguard-2025-outlook",
          "label": "2025 Market Outlook",
          "prompt": "What is Vanguard's 2025 economic outlook for US equities and bonds?",
          "complexity": "Moderate",
          "tags": ["vanguard", "market-outlook", "2025"]
        },
        {
          "id": "how-to-read-10k",
          "label": "How to Read a 10-K",
          "prompt": "How should a first-time investor read a 10-K filing to evaluate company health?",
          "complexity": "Moderate",
          "tags": ["sec", "10-k", "company-analysis"]
        },
        {
          "id": "high-yield-bond-risks",
          "label": "High-Yield Bond Risks",
          "prompt": "What are the risks of high-yield corporate bonds compared to investment-grade?",
          "complexity": "Simple",
          "tags": ["bonds", "risk-analysis"]
        },
        {
          "id": "mutual-fund-fee-types",
          "label": "Mutual Fund Fee Types",
          "prompt": "Explain the difference between front-end loads, back-end loads, and no-load mutual funds",
          "complexity": "Simple",
          "tags": ["fees", "mutual-funds"]
        }
      ]
    },
    {
      "agentIds": ["healthcare-knowledge-base"],
      "starters": [
        {
          "id": "albuterol-contraindications",
          "label": "Albuterol Contraindications",
          "prompt": "List contraindications for Albuterol tablets.",
          "complexity": "Simple",
          "tags": ["medications", "contraindications"]
        },
        {
          "id": "cdc-sterilization",
          "label": "CDC Sterilization Process",
          "prompt": "What is the CDC's recommended sterilization process for reusable surgical instruments?",
          "complexity": "Moderate",
          "tags": ["guidelines", "sterilization", "cdc"]
        },
        {
          "id": "drug-interaction-check",
          "label": "Drug Interaction Analysis",
          "prompt": "What are the potential drug interactions between Albuterol and common blood pressure medications? Include severity levels and recommendations.",
          "complexity": "Advanced",
          "tags": ["multi-source", "interactions", "medications"]
        }
      ]
    },
    {
      "agentIds": ["manufacturing-knowledge-base"],
      "starters": [
        {
          "id": "torque-spec",
          "label": "Engine Assembly Torque",
          "prompt": "What torque value is specified for assembly part 123 on the ZX-200 engine?",
          "complexity": "Simple",
          "tags": ["specifications", "assembly"]
        },
        {
          "id": "airworthiness-directives",
          "label": "EMB-120 Airworthiness Directives",
          "prompt": "List all Airworthiness Directives issued since 2020 for Embraer EMB-120 and summarize key compliance actions.",
          "complexity": "Moderate",
          "tags": ["directives", "compliance", "aviation"]
        },
        {
          "id": "maintenance-schedule",
          "label": "Maintenance Schedule Optimization",
          "prompt": "Based on the EMB-120 maintenance requirements and current Airworthiness Directives, what would be an optimal maintenance schedule to minimize aircraft downtime?",
          "complexity": "Advanced",
          "tags": ["multi-source", "maintenance", "optimization"]
        }
      ]
    },
    {
      "agentIds": ["ontology-kb"],
      "starters": [
        {
          "id": "list-turbines",
          "label": "List All Turbines",
          "prompt": "Show me a list of turbines",
          "complexity": "Simple",
          "tags": ["turbines", "list"]
        },
        {
          "id": "wyoming-turbines",
          "label": "Wyoming Turbines",
          "prompt": "Turbines located in Wyoming",
          "complexity": "Simple",
          "tags": ["turbines", "location"]
        },
        {
          "id": "ge-high-capacity",
          "label": "High Capacity GE Turbines",
          "prompt": "Highest capacity turbines with GE as a manufacturer",
          "complexity": "Moderate",
          "tags": ["turbines", "capacity", "manufacturer"]
        }
      ]
    },
    {
      "agentIds": ["hotels-knowledge-base"],
      "starters": [
        {
          "id": "pool-downtown",
          "label": "Pool & Downtown",
          "prompt": "What hotels have a pool and are near downtown?",
          "complexity": "Simple",
          "tags": ["pool", "location"]
        },
        {
          "id": "luxury-hotels",
          "label": "Luxury Hotels",
          "prompt": "Find luxury hotels with a rating above 4.5",
          "complexity": "Simple",
          "tags": ["luxury", "rating"]
        },
        {
          "id": "budget-family",
          "label": "Budget Family",
          "prompt": "Which budget-friendly hotels have rooms that sleep 4 or more people?",
          "complexity": "Moderate",
          "tags": ["budget", "family", "rooms"]
        },
        {
          "id": "recently-renovated",
          "label": "Recently Renovated",
          "prompt": "Show me hotels that were renovated after 2020 with good reviews",
          "complexity": "Moderate",
          "tags": ["renovation", "reviews"]
        },
        {
          "id": "wifi-breakfast",
          "label": "WiFi & Breakfast",
          "prompt": "Which hotels offer free WiFi and continental breakfast?",
          "complexity": "Simple",
          "tags": ["wifi", "breakfast", "amenities"]
        },
        {
          "id": "ocean-views",
          "label": "Waterfront Hotels",
          "prompt": "What are the best-rated hotels with ocean or waterfront views?",
          "complexity": "Moderate",
          "tags": ["ocean", "waterfront", "rating"]
        }
      ]
    },
    {
      "agentIds": ["zava-knowledge-base"],
      "starters": [
        {
          "id": "zava-marathon-comparison",
          "label": "Marathon Queue & Emergency Planning",
          "prompt": "Comparing expected finish times and crowd surges at the St. Louis and Washington DC marathons, how should Zava set up queue lines and emergency egress for an on-site merch booth using Zava Store Safety and Popup Safety guidelines",
          "complexity": "Moderate",
          "tags": ["marathon", "safety", "crowd-management"]
        },
        {
          "id": "zava-sandiego-popup",
          "label": "San Diego Marathon Popup Timing",
          "prompt": "Based on the road closures, crowd density patterns, and spectator windows for the Sun & Surf Marathon in San Diego and using the Zava Live Event Popup Safety guidelines, what time should our Zava pop-up crew complete load-in, and what crowd-surge risks should we prepare for?",
          "complexity": "Moderate",
          "tags": ["marathon", "popup", "timing", "safety"]
        },
        {
          "id": "zava-supply-chain-analysis",
          "label": "Supply Chain Risk Analysis",
          "prompt": "Using the Zava knowledge base, explain how the supply chain works end-to-end. Then identify which facilities would face the biggest operational risk during a major marathon weekend in a city like St. Louis or Seattle, using marathon road-closure data. Recommend adjustments to shipping or staffing.",
          "complexity": "Advanced",
          "tags": ["multi-source", "supply-chain", "marathon"]
        }
      ]
    },
    {
      "agentIds": ["nasa-earth-book"],
      "starters": [
        {
          "id": "nasa-nighttime",
          "label": "Earth at Night from Space",
          "prompt": "What does Earth look like at night from space?",
          "complexity": "Simple",
          "tags": ["satellite", "earth-at-night", "image"],
          "imageUrl": "https://stfoundryiqdemo2.blob.core.windows.net/nasa-images/earth_lights_lrg.jpg?se=2030-01-01T00%3A00%3A00Z&sp=r&spr=https&sv=2026-02-06&sr=b&sig=Quw81D382gAovdVL083CZA%2FH5GEnUJlPG2GHnDtBE3Y%3D",
          "imageAlt": "Earth city lights at night captured from space by NASA satellites"
        },
        {
          "id": "nasa-satellites",
          "label": "NASA Earth Observation Satellites",
          "prompt": "What satellites does NASA use to observe Earth at night?",
          "complexity": "Moderate",
          "tags": ["satellites", "observation"],
          "imageUrl": "https://stfoundryiqdemo2.blob.core.windows.net/nasa-images/blue-marble-viirs.jpg?se=2030-01-01T00%3A00%3A00Z&sp=r&spr=https&sv=2026-02-06&sr=b&sig=j%2FgTdpfgf%2Fu1jl4a9YqvYnS07AH7nB35ceBW091sRtc%3D",
          "imageAlt": "Blue Marble Earth image captured by Suomi NPP VIIRS instrument"
        },
        {
          "id": "nasa-deforestation",
          "label": "Deforestation Monitoring",
          "prompt": "How does NASA monitor deforestation from space?",
          "complexity": "Moderate",
          "tags": ["deforestation", "satellite"],
          "imageUrl": "https://stfoundryiqdemo2.blob.core.windows.net/nasa-images/deforestation-rondonia.jpg?se=2030-01-01T00%3A00%3A00Z&sp=r&spr=https&sv=2026-02-06&sr=b&sig=0CfRSgfFdf1NVkf6CXjSWAVLQJZjP9wbO4KRmlY9Y18%3D",
          "imageAlt": "Deforestation patterns in Rondonia, Brazil photographed from space"
        },
        {
          "id": "nasa-ocean-temp",
          "label": "Ocean Temperature",
          "prompt": "What are the major findings about ocean temperature changes?",
          "complexity": "Simple",
          "tags": ["ocean", "temperature"],